genres	homepage	keywords	original_language	original_title	overview	popularity	release_date	revenue	runtime	tagline	title	vote_average	vote_count"[{""id"": 14, ""name"": ""Fantasy""}, {""id"": 12, ""name"": ""Adventure""}, {""id"": 28, ""name"": ""Action""}, {""id"": 10751, ""name"": ""Family""}, {""id"": 10749, ""name"": ""Romance""}]"	http://movies.disney.com/maleficent		en	Maleficent	The untold story of Disney's most iconic villain from the 1959 classic 'Sleeping Beauty'. A beautiful, pure-hearted young woman, Maleficent has an idyllic life growing up in a peaceable forest kingdom, until one day when an invading army threatens the harmony of the land.  Maleficent rises to be the land's fiercest protector, but she ultimately suffers a ruthless betrayal – an act that begins to turn her heart into stone. Bent on revenge, Maleficent faces an epic battle with the invading King's successor and, as a result, places a curse upon his newborn infant Aurora. As the child grows, Maleficent realizes that Aurora holds the key to peace in the kingdom - and to Maleficent's true happiness as well.	110.620647	2014-05-28	758539785	97	Don't believe the fairy tale.	Maleficent	7.0	4496
"[{""id"": 878, ""name"": ""Science Fiction""}, {""id"": 28, ""name"": ""Action""}, {""id"": 18, ""name"": ""Drama""}, {""id"": 53, ""name"": ""Thriller""}]"	http://www.dawnofapes.com/		en	Dawn of the Planet of the Apes	A group of scientists in San Francisco struggle to stay alive in the aftermath of a plague that is wiping out humanity, while Caesar tries to maintain dominance over his community of intelligent apes.	243.791743	2014-06-26	710644566	130	One last chance for peace.	Dawn of the Planet of the Apes	7.3	4410
"[{""id"": 28, ""name"": ""Action""}, {""id"": 12, ""name"": ""Adventure""}, {""id"": 878, ""name"": ""Science Fiction""}, {""id"": 10749, ""name"": ""Romance""}]"			en	The Lovers	The Lovers is an epic romance time travel adventure film. Helmed by Roland Joffé from a story by Ajey Jhankar, the film is a sweeping tale of an impossible love set against the backdrop of the first Anglo-Maratha war across two time periods and continents and centred around four characters — a British officer in 18th century colonial India, the Indian woman he falls deeply in love with, an American present-day marine biologist and his wife.	2.418535	2015-02-13	0	109	Love is longer than life.	The Lovers	4.8	34
"[{""id"": 18, ""name"": ""Drama""}, {""id"": 28, ""name"": ""Action""}, {""id"": 12, ""name"": ""Adventure""}, {""id"": 14, ""name"": ""Fantasy""}]"			en	47 Ronin	Based on the original 1941 movie from Japan, and from ancient Japan’s most enduring tale, the epic 3D fantasy-adventure 47 Ronin is born.  Keanu Reeves leads the cast as Kai, an outcast who joins Oishi (Hiroyuki Sanada), the leader of the 47 outcast samurai.  Together they seek vengeance upon the treacherous overlord who killed their master and banished their kind.  To restore honor to their homeland, the warriors embark upon a quest that challenges them with a series of trials that would destroy ordinary warriors.	41.796339	2013-12-06	150962475	119	For courage. For loyalty. For honor.	47 Ronin	5.9	1326
"[{""id"": 28, ""name"": ""Action""}, {""id"": 12, ""name"": ""Adventure""}, {""id"": 878, ""name"": ""Science Fiction""}]"	http://www.captainamericathewintersoldiermovie.com		en	Captain America: The Winter Soldier	After the cataclysmic events in New York with The Avengers, Steve Rogers, aka Captain America is living quietly in Washington, D.C. and trying to adjust to the modern world. But when a S.H.I.E.L.D. colleague comes under attack, Steve becomes embroiled in a web of intrigue that threatens to put the world at risk. Joining forces with the Black Widow, Captain America struggles to expose the ever-widening conspiracy while fighting off professional assassins sent to silence him at every turn. When the full scope of the villainous plot is revealed, Captain America and the Black Widow enlist the help of a new ally, the Falcon. However, they soon find themselves up against an unexpected and formidable enemy—the Winter Soldier.	72.225265	2014-03-20	714766572	136	In heroes we trust.	Captain America: The Winter Soldier	7.6	5764
"[{""id"": 35, ""name"": ""Comedy""}, {""id"": 12, ""name"": ""Adventure""}, {""id"": 14, ""name"": ""Fantasy""}, {""id"": 16, ""name"": ""Animation""}, {""id"": 10751, ""name"": ""Family""}]"	http://www.shrekforeverafter.com/		en	Shrek Forever After	A bored and domesticated Shrek pacts with deal-maker Rumpelstiltskin to get back to feeling like a real ogre again, but when he's duped and sent to a twisted version of Far Far Away—where Rumpelstiltskin is king, ogres are hunted, and he and Fiona have never met—he sets out to restore his world and reclaim his true love.	44.041186	2010-05-16	752600867	93	It ain't Ogre... Til it's Ogre	Shrek Forever After	6.0	1959
"[{""id"": 12, ""name"": ""Adventure""}, {""id"": 10751, ""name"": ""Family""}, {""id"": 9648, ""name"": ""Mystery""}, {""id"": 878, ""name"": ""Science Fiction""}]"	http://movies.disney.com/tomorrowland		en	Tomorrowland	"Bound by a shared destiny, a bright, optimistic teen bursting with scientific curiosity and a former boy-genius inventor jaded by disillusionment embark on a danger-filled mission to unearth the secrets of an enigmatic place somewhere in time and space that exists in their collective memory as ""Tomorrowland."""	130.311355	2015-05-19	209154322	130	Imagine a world where nothing is impossible.	Tomorrowland	6.2	2846
"[{""id"": 12, ""name"": ""Adventure""}, {""id"": 10751, ""name"": ""Family""}, {""id"": 16, ""name"": ""Animation""}, {""id"": 28, ""name"": ""Action""}, {""id"": 35, ""name"": ""Comedy""}]"	http://movies.disney.com/big-hero-6		en	Big Hero 6	The special bond that develops between plus-sized inflatable robot Baymax, and prodigy Hiro Hamada, who team up with a group of friends to form a band of high-tech heroes.	203.73459	2014-10-24	652105443	102	From the creators of Wreck-it Ralph and Frozen	Big Hero 6	7.8	6135
"[{""id"": 10751, ""name"": ""Family""}, {""id"": 16, ""name"": ""Animation""}, {""id"": 35, ""name"": ""Comedy""}, {""id"": 12, ""name"": ""Adventure""}]"	http://disney.go.com/wreck-it-ralph		en	Wreck-It Ralph	Wreck-It Ralph is the 9-foot-tall, 643-pound villain of an arcade video game named Fix-It Felix Jr., in which the game's titular hero fixes buildings that Ralph destroys. Wanting to prove he can be a good guy and not just a villain, Ralph escapes his game and lands in Hero's Duty, a first-person shooter where he helps the game's hero battle against alien invaders. He later enters Sugar Rush, a kart racing game set on tracks made of candies, cookies and other sweets. There, Ralph meets Vanellope von Schweetz who has learned that her game is faced with a dire threat that could affect the entire arcade, and one that Ralph may have inadvertently started.	62.341073	2012-11-01	471222889	108	The story of a regular guy just looking for a little wreck-ognition.	Wreck-It Ralph	7.1	4570
"[{""id"": 12, ""name"": ""Adventure""}, {""id"": 16, ""name"": ""Animation""}, {""id"": 10751, ""name"": ""Family""}, {""id"": 14, ""name"": ""Fantasy""}]"			en	The Polar Express	When a doubting young boy takes an extraordinary train ride to the North Pole, he embarks on a journey of self-discovery that shows him that the wonder of life never fades for those who believe.	47.323228	2004-11-10	305875730	100	This holiday season... believe.	The Polar Express	6.4	1474
"[{""id"": 28, ""name"": ""Action""}, {""id"": 12, ""name"": ""Adventure""}, {""id"": 878, ""name"": ""Science Fiction""}]"	http://www.warof1996.com		en	Independence Day: Resurgence	We always knew they were coming back. Using recovered alien technology, the nations of Earth have collaborated on an immense defense program to protect the planet. But nothing can prepare us for the aliens’ advanced and unprecedented force. Only the ingenuity of a few brave men and women can bring our world back from the brink of extinction.	48.775723	2016-06-22	389681935	120	We had twenty years to prepare. So did they.	Independence Day: Resurgence	4.9	2491
"[{""id"": 14, ""name"": ""Fantasy""}, {""id"": 12, ""name"": ""Adventure""}, {""id"": 16, ""name"": ""Animation""}, {""id"": 10751, ""name"": ""Family""}]"	http://www.howtotrainyourdragon.com/		en	How to Train Your Dragon	As the son of a Viking leader on the cusp of manhood, shy Hiccup Horrendous Haddock III faces a rite of passage: he must kill a dragon to prove his warrior mettle. But after downing a feared dragon, he realizes that he no longer wants to destroy it, and instead befriends the beast – which he names Toothless – much to the chagrin of his warrior father	67.263269	2010-03-05	494878759	98	One adventure will change two worlds	How to Train Your Dragon	7.5	4227
"[{""id"": 28, ""name"": ""Action""}, {""id"": 53, ""name"": ""Thriller""}, {""id"": 878, ""name"": ""Science Fiction""}]"			en	Terminator 3: Rise of the Machines	It's been 10 years since John Connor saved Earth from Judgment Day, and he's now living under the radar, steering clear of using anything Skynet can trace. That is, until he encounters T-X, a robotic assassin ordered to finish what T-1000 started. Good thing Connor's former nemesis, the Terminator, is back to aid the now-adult Connor … just like he promised.	69.405188	2003-07-02	435000000	109	The Machines Will Rise.	Terminator 3: Rise of the Machines	5.9	2143
"[{""id"": 28, ""name"": ""Action""}, {""id"": 878, ""name"": ""Science Fiction""}, {""id"": 12, ""name"": ""Adventure""}]"	http://marvel.com/guardians		en	Guardians of the Galaxy	Light years from Earth, 26 years after being abducted, Peter Quill finds himself the prime target of a manhunt after discovering an orb wanted by Ronan the Accuser.	481.098624	2014-07-30	773328629	121	All heroes start somewhere.	Guardians of the Galaxy	7.9	9742
"[{""id"": 12, ""name"": ""Adventure""}, {""id"": 18, ""name"": ""Drama""}, {""id"": 878, ""name"": ""Science Fiction""}]"	http://www.interstellarmovie.net/		en	Interstellar	Interstellar chronicles the adventures of a group of explorers who make use of a newly discovered wormhole to surpass the limitations on human space travel and conquer the vast distances involved in an interstellar voyage.	724.247784	2014-11-05	675120017	169	Mankind was born on Earth. It was never meant to die here.	Interstellar	8.1	10867
"[{""id"": 28, ""name"": ""Action""}, {""id"": 53, ""name"": ""Thriller""}, {""id"": 878, ""name"": ""Science Fiction""}, {""id"": 9648, ""name"": ""Mystery""}, {""id"": 12, ""name"": ""Adventure""}]"	http://inceptionmovie.warnerbros.com/		en	Inception	"Cobb, a skilled thief who commits corporate espionage by infiltrating the subconscious of his targets is offered a chance to regain his old life as payment for a task considered to be impossible: ""inception"", the implantation of another person's idea into a target's subconscious."	167.58371	2010-07-14	825532764	148	Your mind is the scene of the crime.	Inception	8.1	13752
"[{""id"": 28, ""name"": ""Action""}, {""id"": 12, ""name"": ""Adventure""}, {""id"": 18, ""name"": ""Drama""}, {""id"": 27, ""name"": ""Horror""}, {""id"": 878, ""name"": ""Science Fiction""}]"			ja	シン・ゴジラ	From the mind behind Evangelion comes a hit larger than life.  When a massive, gilled monster emerges from the deep and tears through the city, the government scrambles to save its citizens.  A rag-tag team of volunteers cuts through a web of red tape to uncover the monster's weakness and its mysterious ties to a foreign superpower.  But time is not on their side - the greatest catastrophe to ever befall the world is about to evolve right before their very eyes.	9.476999	2016-07-29	77000000	120	A god incarnate. A city doomed.	Shin Godzilla	6.5	143
"[{""id"": 12, ""name"": ""Adventure""}, {""id"": 14, ""name"": ""Fantasy""}, {""id"": 28, ""name"": ""Action""}]"	http://www.thehobbit.com/		en	The Hobbit: An Unexpected Journey	Bilbo Baggins, a hobbit enjoying his quiet life, is swept into an epic quest by Gandalf the Grey and thirteen dwarves who seek to reclaim their mountain home from Smaug, the dragon.	108.849621	2012-11-26	1021103568	169	From the smallest beginnings come the greatest legends.	The Hobbit: An Unexpected Journey	7.0	8297
"[{""id"": 28, ""name"": ""Action""}, {""id"": 80, ""name"": ""Crime""}, {""id"": 53, ""name"": ""Thriller""}]"			en	The Fast and the Furious	Domenic Toretto is a Los Angeles street racer suspected of masterminding a series of big-rig hijackings. When undercover cop Brian O'Conner infiltrates Toretto's iconoclastic crew, he falls for Toretto's sister and must choose a side: the gang or the LAPD.	6.909942	2001-06-22	207283925	106	Live life 1/4 mile at a time.	The Fast and the Furious	6.6	3428
"[{""id"": 14, ""name"": ""Fantasy""}, {""id"": 18, ""name"": ""Drama""}, {""id"": 53, ""name"": ""Thriller""}, {""id"": 9648, ""name"": ""Mystery""}, {""id"": 10749, ""name"": ""Romance""}]"	http://www.benjaminbutton.com/		en	The Curious Case of Benjamin Button	Tells the story of Benjamin Button, a man who starts aging backwards with bizarre consequences.	60.269279	2008-11-24	333932083	166	Life isn't measured in minutes, but in moments.	The Curious Case of Benjamin Button	7.3	3292
"[{""id"": 28, ""name"": ""Action""}, {""id"": 878, ""name"": ""Science Fiction""}, {""id"": 12, ""name"": ""Adventure""}]"	http://www.x-menfirstclassmovie.com/		en	X-Men: First Class	Before Charles Xavier and Erik Lensherr took the names Professor X and Magneto, they were two young men discovering their powers for the first time. Before they were arch-enemies, they were closest of friends, working together with other mutants (some familiar, some new), to stop the greatest threat the world has ever known.	3.195174	2011-05-24	353624124	132	Witness the moment that will change our world.	X-Men: First Class	7.1	5181
"[{""id"": 28, ""name"": ""Action""}, {""id"": 12, ""name"": ""Adventure""}, {""id"": 878, ""name"": ""Science Fiction""}]"	http://www.thehungergames.movie/		en	The Hunger Games: Mockingjay - Part 2	With the nation of Panem in a full scale war, Katniss confronts President Snow in the final showdown. Teamed with a group of her closest friends – including Gale, Finnick, and Peeta – Katniss goes off on a mission with the unit from District 13 as they risk their lives to stage an assassination attempt on President Snow who has become increasingly obsessed with destroying her. The mortal traps, enemies, and moral choices that await Katniss will challenge her more than any arena she faced in The Hunger Games.	127.284427	2015-11-18	653428261	137	The fire will burn forever.	The Hunger Games: Mockingjay - Part 2	6.6	3984
"[{""id"": 14, ""name"": ""Fantasy""}, {""id"": 12, ""name"": ""Adventure""}, {""id"": 28, ""name"": ""Action""}, {""id"": 35, ""name"": ""Comedy""}, {""id"": 18, ""name"": ""Drama""}]"	http://disney.go.com/disneypictures/sorcerersapprentice/		en	The Sorcerer's Apprentice	Balthazar Blake is a master sorcerer in modern-day Manhattan trying to defend the city from his arch-nemesis, Maxim Horvath. Balthazar can't do it alone, so he recruits Dave Stutler, a seemingly average guy who demonstrates hidden potential, as his reluctant protégé. The sorcerer gives his unwilling accomplice a crash course in the art and science of magic, and together, these unlikely partners work to stop the forces of darkness.	35.580815	2010-07-13	215283742	109	It's The Coolest Job Ever.	The Sorcerer's Apprentice	5.8	1470
"[{""id"": 12, ""name"": ""Adventure""}, {""id"": 28, ""name"": ""Action""}, {""id"": 18, ""name"": ""Drama""}, {""id"": 53, ""name"": ""Thriller""}]"	http://www2.warnerbros.com/poseidon/		en	Poseidon	A packed cruise ship traveling the Atlantic is hit and overturned by a massive wave, compelling the passengers to begin a dramatic fight for their lives.	21.133748	2006-05-12	181674817	99	Mayday	Poseidon	5.5	583
"[{""id"": 14, ""name"": ""Fantasy""}]"	http://movies.disney.com/alice-through-the-looking-glass		en	Alice Through the Looking Glass	"In the sequel to Tim Burton's ""Alice in Wonderland"", Alice Kingsleigh returns to Underland and faces a new adventure in saving the Mad Hatter."	56.268916	2016-05-25	299370084	113	It's time for a little madness.	Alice Through the Looking Glass	6.5	1725
"[{""id"": 14, ""name"": ""Fantasy""}, {""id"": 12, ""name"": ""Adventure""}, {""id"": 16, ""name"": ""Animation""}, {""id"": 35, ""name"": ""Comedy""}, {""id"": 10751, ""name"": ""Family""}]"	http://www.shrekthethird.com/flash/index.html		en	Shrek the Third	The King of Far Far Away has died and Shrek and Fiona are to become King &amp; Queen. However, Shrek wants to return to his cozy swamp and live in peace and quiet, so when he finds out there is another heir to the throne, they set off to bring him back to rule the kingdom.	42.986467	2007-05-17	798958165	93	Who's ready for Thirds?	Shrek the Third	6.0	2278
"[{""id"": 28, ""name"": ""Action""}, {""id"": 12, ""name"": ""Adventure""}, {""id"": 14, ""name"": ""Fantasy""}]"	http://www.warcraft-themovie.com/		en	Warcraft	The peaceful realm of Azeroth stands on the brink of war as its civilization faces a fearsome race of invaders: orc warriors fleeing their dying home to colonize another. As a portal opens to connect the two worlds, one army faces destruction and the other faces extinction. From opposing sides, two heroes are set on a collision course that will decide the fate of their family, their people, and their home.	63.148529	2016-05-25	433677183	123	Two worlds. One home.	Warcraft	6.3	2268
"[{""id"": 878, ""name"": ""Science Fiction""}, {""id"": 28, ""name"": ""Action""}, {""id"": 53, ""name"": ""Thriller""}, {""id"": 12, ""name"": ""Adventure""}]"	http://www.terminatormovie.com/		en	Terminator Genisys	The year is 2029. John Connor, leader of the resistance continues the war against the machines. At the Los Angeles offensive, John's fears of the unknown future begin to emerge when TECOM spies reveal a new plot by SkyNet that will attack him from both fronts; past and future, and will ultimately change warfare forever.	202.042635	2015-06-23	440603537	126	Reset the future	Terminator Genisys	5.8	3631
"[{""id"": 12, ""name"": ""Adventure""}, {""id"": 10751, ""name"": ""Family""}, {""id"": 14, ""name"": ""Fantasy""}]"			en	The Chronicles of Narnia: The Voyage of the Dawn Treader	This time around Edmund and Lucy Pevensie, along with their pesky cousin Eustace Scrubb find themselves swallowed into a painting and on to a fantastic Narnian ship headed for the very edges of the world.	49.661984	2010-08-13	415686217	113	Return to magic. Return to hope. Return to Narnia.	The Chronicles of Narnia: The Voyage of the Dawn Treader	6.2	1514
"[{""id"": 36, ""name"": ""History""}, {""id"": 10749, ""name"": ""Romance""}, {""id"": 10752, ""name"": ""War""}]"			en	Pearl Harbor	The lifelong friendship between Rafe McCawley and Danny Walker is put to the ultimate test when the two ace fighter pilots become entangled in a love triangle with beautiful Naval nurse Evelyn Johnson. But the rivalry between the friends-turned-foes is immediately put on hold when they find themselves at the center of Japan's devastating attack on Pearl Harbor on Dec. 7, 1941.	34.20669	2001-05-21	449220945	183	It takes a moment to change history. It takes love to change lives.	Pearl Harbor	6.6	1791
"[{""id"": 12, ""name"": ""Adventure""}, {""id"": 878, ""name"": ""Science Fiction""}, {""id"": 28, ""name"": ""Action""}]"	http://www.transformersmovie.com/		en	Transformers	Young teenager, Sam Witwicky becomes involved in the ancient struggle between two extraterrestrial factions of transforming robots – the heroic Autobots and the evil Decepticons. Sam holds the clue to unimaginable power and the Decepticons will stop at nothing to retrieve it.	25.468493	2007-06-27	709709780	144	Their war. Our world.	Transformers	6.6	4040
"[{""id"": 10752, ""name"": ""War""}, {""id"": 36, ""name"": ""History""}, {""id"": 28, ""name"": ""Action""}, {""id"": 12, ""name"": ""Adventure""}, {""id"": 18, ""name"": ""Drama""}, {""id"": 10749, ""name"": ""Romance""}]"			en	Alexander	Alexander, the King of Macedonia, leads his legions against the giant Persian Empire. After defeating the Persians, he leads his army across the then known world, venturing farther than any westerner had ever gone, all the way to India.	39.019229	2004-11-21	167298192	175	The greatest legend of all was real.	Alexander	5.6	927
"[{""id"": 12, ""name"": ""Adventure""}, {""id"": 14, ""name"": ""Fantasy""}, {""id"": 10751, ""name"": ""Family""}, {""id"": 9648, ""name"": ""Mystery""}]"	http://www.harrypotterorderofthephoenix.com/		en	Harry Potter and the Order of the Phoenix	Returning for his fifth year of study at Hogwarts, Harry is stunned to find that his warnings about the return of Lord Voldemort have been ignored. Left with no choice, Harry takes matters into his own hands, training a small group of students – dubbed 'Dumbledore's Army' – to defend themselves against the dark arts.	78.144395	2007-06-28	938212738	138	Evil Must Be Confronted.	Harry Potter and the Order of the Phoenix	7.4	5494
"[{""id"": 12, ""name"": ""Adventure""}, {""id"": 14, ""name"": ""Fantasy""}, {""id"": 10751, ""name"": ""Family""}]"	http://harrypotter.warnerbros.com/		en	Harry Potter and the Goblet of Fire	Harry starts his fourth year at Hogwarts, competes in the treacherous Triwizard Tournament and faces the evil Lord Voldemort. Ron and Hermione help Harry manage the pressure – but Voldemort lurks, awaiting his chance to destroy Harry and all that he stands for.	101.250416	2005-11-05	895921036	157	Dark And Difficult Times Lie Ahead.	Harry Potter and the Goblet of Fire	7.5	5608
"[{""id"": 14, ""name"": ""Fantasy""}, {""id"": 28, ""name"": ""Action""}]"	http://www.sonypictures.com/movies/hancock/		en	Hancock	Hancock is a down-and-out superhero who's forced to employ a PR expert to help repair his image when the public grows weary of all the damage he's inflicted during his lifesaving heroics. The agent's idea of imprisoning the antihero to make the world miss him proves successful, but will Hancock stick to his new sense of purpose or slip back into old habits?	56.758411	2008-07-01	624029371	92	Bad Behavior. Bad Attitude. Real Hero.	Hancock	6.2	2961
"[{""id"": 18, ""name"": ""Drama""}, {""id"": 27, ""name"": ""Horror""}, {""id"": 28, ""name"": ""Action""}, {""id"": 53, ""name"": ""Thriller""}, {""id"": 878, ""name"": ""Science Fiction""}]"	http://iamlegend.warnerbros.com/		en	I Am Legend	Robert Neville is a scientist who was unable to stop the spread of the terrible virus that was incurable and man-made. Immune, Neville is now the last human survivor in what is left of New York City and perhaps the world. For three years, Neville has faithfully sent out daily radio messages, desperate to find any other survivors who might be out there. But he is not alone.	70.867401	2007-12-14	585349010	101	The last man on Earth is not alone	I Am Legend	6.9	4853
"[{""id"": 12, ""name"": ""Adventure""}, {""id"": 35, ""name"": ""Comedy""}, {""id"": 10751, ""name"": ""Family""}, {""id"": 14, ""name"": ""Fantasy""}]"	https://www.warnerbros.com/charlie-and-chocolate-factory		en	Charlie and the Chocolate Factory	A young boy wins a tour through the most magnificent chocolate factory in the world, led by the world's most unusual candy maker.	53.905592	2005-07-13	474968763	115	Willy Wonka is semi-sweet and nuts.	Charlie and the Chocolate Factory	6.7	3624
"[{""id"": 16, ""name"": ""Animation""}, {""id"": 35, ""name"": ""Comedy""}, {""id"": 10751, ""name"": ""Family""}, {""id"": 14, ""name"": ""Fantasy""}]"	http://disney.go.com/disneypictures/ratatouille/		en	Ratatouille	A rat named Remy dreams of becoming a great French chef despite his family's wishes and the obvious problem of being a rat in a decidedly rodent-phobic profession. When fate places Remy in the sewers of Paris, he finds himself ideally situated beneath a restaurant made famous by his culinary hero, Auguste Gusteau. Despite the apparent dangers of being an unlikely - and certainly unwanted - visitor in the kitchen of a fine French restaurant, Remy's passion for cooking soon sets into motion a hilarious and exciting rat race that turns the culinary world of Paris upside down.	65.677399	2007-06-22	623722818	111	He's dying to become a chef.	Ratatouille	7.5	4369
"[{""id"": 28, ""name"": ""Action""}, {""id"": 80, ""name"": ""Crime""}, {""id"": 18, ""name"": ""Drama""}]"	http://www2.warnerbros.com/batmanbegins/index.html		en	Batman Begins	Driven by tragedy, billionaire Bruce Wayne dedicates his life to uncovering and defeating the corruption that plagues his home, Gotham City.  Unable to work within the system, he instead creates a new identity, a symbol of fear for the criminal underworld - The Batman.	115.040024	2005-06-10	374218673	140	Evil fears the knight.	Batman Begins	7.5	7359
"[{""id"": 10751, ""name"": ""Family""}, {""id"": 16, ""name"": ""Animation""}]"	http://www.madagascar-themovie.com		en	Madagascar: Escape 2 Africa	Alex, Marty, Melman, Gloria, King Julien, Maurice, the penguins and the chimps are back and still marooned on Madagascar. In the face of this obstacle, the New Yorkers have hatched a plan so crazy it just might work. With military precision, the penguins have repaired an old crashed plane... sort of.	44.141021	2008-10-30	603900354	89	Still together. Still lost!	Madagascar: Escape 2 Africa	6.2	1810
