genres	homepage	keywords	original_language	original_title	overview	popularity	release_date	revenue	runtime	tagline	title	vote_average	vote_count"[{""id"": 12, ""name"": ""Adventure""}, {""id"": 28, ""name"": ""Action""}, {""id"": 53, ""name"": ""Thriller""}, {""id"": 878, ""name"": ""Science Fiction""}]"	http://greenlanternmovie.warnerbros.com/		en	Green Lantern	For centuries, a small but powerful force of warriors called the Green Lantern Corps has sworn to keep intergalactic order. Each Green Lantern wears a ring that grants him superpowers. But when a new enemy called Parallax threatens to destroy the balance of power in the Universe, their fate and the fate of Earth lie in the hands of the first human ever recruited.	51.872839	2011-06-16	219851172	114	In our darkest hour, there will be light.	Green Lantern	5.1	2487
"[{""id"": 16, ""name"": ""Animation""}, {""id"": 10751, ""name"": ""Family""}, {""id"": 35, ""name"": ""Comedy""}]"	http://disney.go.com/toystory/		en	Toy Story 3	Woody, Buzz, and the rest of Andy's toys haven't been played with in years. With Andy about to go to college, the gang find themselves accidentally left at a nefarious day care center. The toys must band together to escape and return home to Andy.	59.995418	2010-06-16	1066969703	103	No toy gets left behind.	Toy Story 3	7.6	4597
"[{""id"": 28, ""name"": ""Action""}, {""id"": 878, ""name"": ""Science Fiction""}, {""id"": 53, ""name"": ""Thriller""}]"	https://www.warnerbros.com/terminator-salvation		en	Terminator Salvation	All grown up in post-apocalyptic 2018, John Connor must lead the resistance of humans against the increasingly dominating militaristic robots. But when Marcus Wright appears, his existence confuses the mission as Connor tries to determine whether Wright has come from the future or the past -- and whether he's friend or foe.	71.862892	2009-05-20	371353001	115	The End Begins.	Terminator Salvation	5.9	2463
"[{""id"": 28, ""name"": ""Action""}]"	http://www.furious7.com/		en	Furious 7	Deckard Shaw seeks revenge against Dominic Toretto and his family for his comatose brother.	102.322217	2015-04-01	1506249360	137	Vengeance Hits Home	Furious 7	7.3	4176
"[{""id"": 28, ""name"": ""Action""}, {""id"": 18, ""name"": ""Drama""}, {""id"": 27, ""name"": ""Horror""}, {""id"": 878, ""name"": ""Science Fiction""}, {""id"": 53, ""name"": ""Thriller""}]"	http://www.worldwarzmovie.com		en	World War Z	Life for former United Nations investigator Gerry Lane and his family seems content. Suddenly, the world is plagued by a mysterious infection turning whole human populations into rampaging mindless zombies. After barely escaping the chaos, Lane is persuaded to go on a mission to investigate this disease. What follows is a perilous trek around the world where Lane must brave horrific dangers and long odds to find answers before human civilization falls.	81.834855	2013-06-20	531865000	116	Remember Philly!	World War Z	6.7	5560
"[{""id"": 28, ""name"": ""Action""}, {""id"": 12, ""name"": ""Adventure""}, {""id"": 14, ""name"": ""Fantasy""}, {""id"": 878, ""name"": ""Science Fiction""}]"	http://www.x-menmovies.com/		en	X-Men: Days of Future Past	The ultimate X-Men ensemble fights a war for the survival of the species across two time periods as they join forces with their younger selves in an epic battle that must change the past – to save our future.	118.078691	2014-05-15	747862775	131	To save the future, they must alter the past	X-Men: Days of Future Past	7.5	6032
"[{""id"": 28, ""name"": ""Action""}, {""id"": 12, ""name"": ""Adventure""}, {""id"": 878, ""name"": ""Science Fiction""}]"			en	Star Trek Into Darkness	When the crew of the Enterprise is called back home, they find an unstoppable force of terror from within their own organization has detonated the fleet and everything it stands for, leaving our world in a state of crisis.  With a personal score to settle, Captain Kirk leads a manhunt to a war-zone world to capture a one man weapon of mass destruction. As our heroes are propelled into an epic chess game of life and death, love will be challenged, friendships will be torn apart, and sacrifices must be made for the only family Kirk has left: his crew.	78.291018	2013-05-05	467365246	132	Earth Will Fall	Star Trek Into Darkness	7.4	4418
"[{""id"": 28, ""name"": ""Action""}, {""id"": 10751, ""name"": ""Family""}, {""id"": 14, ""name"": ""Fantasy""}]"	http://jackthegiantkiller.warnerbros.com		en	Jack the Giant Slayer	The story of an ancient war that is reignited when a young farmhand unwittingly opens a gateway between our world and a fearsome race of giants. Unleashed on the Earth for the first time in centuries, the giants strive to reclaim the land they once lost, forcing the young man, Jack into the battle of his life to stop them. Fighting for a kingdom, its people, and the love of a brave princess, he comes face to face with the unstoppable warriors he thought only existed in legend–and gets the chance to become a legend himself.	43.349855	2013-02-27	197687603	114	Prepare for a giant adventure	Jack the Giant Slayer	5.5	2598
"[{""id"": 18, ""name"": ""Drama""}, {""id"": 10749, ""name"": ""Romance""}]"			en	The Great Gatsby	An adaptation of F. Scott Fitzgerald's Long Island-set novel, where Midwesterner Nick Carraway is lured into the lavish world of his neighbor, Jay Gatsby. Soon enough, however, Carraway will see through the cracks of Gatsby's nouveau riche existence, where obsession, madness, and tragedy await.	61.196071	2013-05-10	351040419	143	Reserving judgments is a matter of infinite hope... I come to the admission that it has a limit.	The Great Gatsby	7.3	3769
"[{""id"": 12, ""name"": ""Adventure""}, {""id"": 14, ""name"": ""Fantasy""}, {""id"": 28, ""name"": ""Action""}, {""id"": 10749, ""name"": ""Romance""}]"	http://disney.go.com/disneypictures/princeofpersia		en	Prince of Persia: The Sands of Time	A rogue prince reluctantly joins forces with a mysterious princess and together, they race against dark forces to safeguard an ancient dagger capable of releasing the Sands of Time – gift from the gods that can reverse time and allow its possessor to rule the world.	62.169881	2010-05-19	335154643	116	Defy the Future	Prince of Persia: The Sands of Time	6.2	2317
"[{""id"": 28, ""name"": ""Action""}, {""id"": 878, ""name"": ""Science Fiction""}, {""id"": 12, ""name"": ""Adventure""}]"	http://www.pacificrimmovie.com/		en	Pacific Rim	When legions of monstrous creatures, known as Kaiju, started rising from the sea, a war began that would take millions of lives and consume humanity's resources for years on end. To combat the giant Kaiju, a special type of weapon was devised: massive robots, called Jaegers, which are controlled simultaneously by two pilots whose minds are locked in a neural bridge. But even the Jaegers are proving nearly defenseless in the face of the relentless Kaiju. On the verge of defeat, the forces defending mankind have no choice but to turn to two unlikely heroes—a washed-up former pilot (Charlie Hunnam) and an untested trainee (Rinko Kikuchi)—who are teamed to drive a legendary but seemingly obsolete Jaeger from the past. Together, they stand as mankind's last hope against the mounting apocalypse.	56.523205	2013-07-11	407602906	131	To Fight Monsters, We Created Monsters	Pacific Rim	6.7	4794
"[{""id"": 28, ""name"": ""Action""}, {""id"": 878, ""name"": ""Science Fiction""}, {""id"": 12, ""name"": ""Adventure""}]"	http://www.transformersmovie.com/		en	Transformers: Dark of the Moon	Sam Witwicky takes his first tenuous steps into adulthood while remaining a reluctant human ally of Autobot-leader Optimus Prime. The film centers around the space race between the USSR and the USA, suggesting there was a hidden Transformers role in it all that remains one of the planet's most dangerous secrets.	28.529607	2011-06-28	1123746996	154	The invasion we always feared. An enemy we never expected.	Transformers: Dark of the Moon	6.1	3299
"[{""id"": 12, ""name"": ""Adventure""}, {""id"": 28, ""name"": ""Action""}]"	http://www.indianajones.com/site/index.html		en	Indiana Jones and the Kingdom of the Crystal Skull	Set during the Cold War, the Soviets – led by sword-wielding Irina Spalko – are in search of a crystal skull which has supernatural powers related to a mystical Lost City of Gold. After being captured and then escaping from them, Indy is coerced to head to Peru at the behest of a young man whose friend – and Indy's colleague – Professor Oxley has been captured for his knowledge of the skull's whereabouts.	75.674458	2008-05-21	786636033	122	The adventure continues . . .	Indiana Jones and the Kingdom of the Crystal Skull	5.7	2495
"[{""id"": 12, ""name"": ""Adventure""}, {""id"": 16, ""name"": ""Animation""}, {""id"": 10751, ""name"": ""Family""}]"	http://movies.disney.com/the-good-dinosaur		en	The Good Dinosaur	An epic journey into the world of dinosaurs where an Apatosaurus named Arlo makes an unlikely human friend.	51.692953	2015-11-14	331926147	93	Little Arms With Big Attitude	The Good Dinosaur	6.6	1736
"[{""id"": 16, ""name"": ""Animation""}, {""id"": 12, ""name"": ""Adventure""}, {""id"": 35, ""name"": ""Comedy""}, {""id"": 10751, ""name"": ""Family""}, {""id"": 28, ""name"": ""Action""}, {""id"": 14, ""name"": ""Fantasy""}]"	http://disney.go.com/brave/#/home		en	Brave	Brave is set in the mystical Scottish Highlands, where Mérida is the princess of a kingdom ruled by King Fergus and Queen Elinor. An unruly daughter and an accomplished archer, Mérida one day defies a sacred custom of the land and inadvertently brings turmoil to the kingdom. In an attempt to set things right, Mérida seeks out an eccentric old Wise Woman and is granted an ill-fated wish. Also figuring into Mérida’s quest — and serving as comic relief — are the kingdom’s three lords: the enormous Lord MacGuffin, the surly Lord Macintosh, and the disagreeable Lord Dingwall.	125.114374	2012-06-21	538983207	93	Change your fate.	Brave	6.7	4641
"[{""id"": 28, ""name"": ""Action""}, {""id"": 12, ""name"": ""Adventure""}, {""id"": 878, ""name"": ""Science Fiction""}]"	http://www.startrekmovie.com/		en	Star Trek Beyond	The USS Enterprise crew explores the furthest reaches of uncharted space, where they encounter a mysterious new enemy who puts them and everything the Federation stands for to the test.	65.352913	2016-07-07	343471816	122		Star Trek Beyond	6.6	2568
"[{""id"": 16, ""name"": ""Animation""}, {""id"": 10751, ""name"": ""Family""}]"	http://disney.go.com/disneypictures/wall-e/		en	WALL·E	WALL·E is the last robot left on an Earth that has been overrun with garbage and all humans have fled to outer space. For 700 years he has continued to try and clean up the mess, but has developed some rather interesting human-like qualities. When a ship arrives with a sleek new type of robot, WALL·E thinks he's finally found a friend and stows away on the ship when it leaves.	66.390712	2008-06-22	521311860	98	An adventure beyond the ordinar-E.	WALL·E	7.8	6296
"[{""id"": 28, ""name"": ""Action""}, {""id"": 35, ""name"": ""Comedy""}, {""id"": 80, ""name"": ""Crime""}, {""id"": 53, ""name"": ""Thriller""}]"			en	Rush Hour 3	After an attempted assassination on Ambassador Han, Inspector Lee and Detective Carter are back in action as they head to Paris to protect a French woman with knowledge of the Triads' secret leaders. Lee also holds secret meetings with a United Nations authority, but his personal struggles with a Chinese criminal mastermind named Kenji, which reveals that it's Lee's long-lost...brother.	22.57178	2007-08-08	258022233	91	The Rush Is On!	Rush Hour 3	6.1	783
"[{""id"": 28, ""name"": ""Action""}, {""id"": 12, ""name"": ""Adventure""}, {""id"": 878, ""name"": ""Science Fiction""}]"	http://www.sonypictures.com/movies/2012		en	2012	"Dr. Adrian Helmsley, part of a worldwide geophysical team investigating the effect on the earth of radiation from unprecedented solar storms, learns that the earth's core is heating up. He warns U.S. President Thomas Wilson that the crust of the earth is becoming unstable and that without proper preparations for saving a fraction of the world's population, the entire race is doomed. Meanwhile, writer Jackson Curtis stumbles on the same information. While the world's leaders race to build ""arks"" to escape the impending cataclysm, Curtis struggles to find a way to save his family. Meanwhile, volcanic eruptions and earthquakes of unprecedented strength wreak havoc around the world."	45.274225	2009-10-10	769653595	158	We Were Warned.	2012	5.6	4903
"[{""id"": 16, ""name"": ""Animation""}, {""id"": 18, ""name"": ""Drama""}]"	http://disney.go.com/disneypictures/achristmascarol/?cmp=dcom_VAN_WDSHE_ACC_van_dcomcc__Extl		en	A Christmas Carol	Miser Ebenezer Scrooge is awakened on Christmas Eve by spirits who reveal to him his own miserable existence, what opportunities he wasted in his youth, his current cruelties, and the dire fate that awaits him if he does not change his ways. Scrooge is faced with his own story of growing bitterness and meanness, and must decide what his own future will hold: death or redemption.	39.744242	2009-11-04	325233863	96	Season's Greedings	A Christmas Carol	6.6	1095
"[{""id"": 878, ""name"": ""Science Fiction""}, {""id"": 14, ""name"": ""Fantasy""}, {""id"": 28, ""name"": ""Action""}, {""id"": 12, ""name"": ""Adventure""}]"	http://www.jupiterascending.com		en	Jupiter Ascending	In a universe where human genetic material is the most precious commodity, an impoverished young Earth woman becomes the key to strategic maneuvers and internal strife within a powerful dynasty…	85.36908	2015-02-04	183987723	124	Expand your universe.	Jupiter Ascending	5.2	2768
"[{""id"": 28, ""name"": ""Action""}, {""id"": 12, ""name"": ""Adventure""}]"	http://legendoftarzan.com		en	The Legend of Tarzan	Tarzan, having acclimated to life in London, is called back to his former home in the jungle to investigate the activities at a mining encampment.	42.741719	2016-06-29	356743061	109	Human. Nature.	The Legend of Tarzan	5.5	2430
"[{""id"": 12, ""name"": ""Adventure""}, {""id"": 10751, ""name"": ""Family""}, {""id"": 14, ""name"": ""Fantasy""}]"			en	The Chronicles of Narnia: The Lion, the Witch and the Wardrobe	Siblings Lucy, Edmund, Susan and Peter step through a magical wardrobe and find the land of Narnia. There, the they discover a charming, once peaceful kingdom that has been plunged into eternal winter by the evil White Witch, Jadis. Aided by the wise and magnificent lion, Aslan, the children lead Narnia into a spectacular, climactic battle to be free of the Witch's glacial powers forever.	67.391328	2005-12-07	748806957	143	Evil Has Reigned For 100 Years...	The Chronicles of Narnia: The Lion, the Witch and the Wardrobe	6.7	2629
"[{""id"": 878, ""name"": ""Science Fiction""}]"	http://www.foxmovies.com/movies/x-men-apocalypse		en	X-Men: Apocalypse	After the re-emergence of the world's first mutant, world-destroyer Apocalypse, the X-Men must unite to defeat his extinction level plan.	139.272042	2016-05-18	543934787	144	Only the strong will survive	X-Men: Apocalypse	6.4	4721
"[{""id"": 18, ""name"": ""Drama""}, {""id"": 28, ""name"": ""Action""}, {""id"": 80, ""name"": ""Crime""}, {""id"": 53, ""name"": ""Thriller""}]"	http://thedarkknight.warnerbros.com/dvdsite/		en	The Dark Knight	Batman raises the stakes in his war on crime. With the help of Lt. Jim Gordon and District Attorney Harvey Dent, Batman sets out to dismantle the remaining criminal organizations that plague the streets. The partnership proves to be effective, but they soon find themselves prey to a reign of chaos unleashed by a rising criminal mastermind known to the terrified citizens of Gotham as the Joker.	187.322927	2008-07-16	1004558444	152	Why So Serious?	The Dark Knight	8.2	12002
"[{""id"": 16, ""name"": ""Animation""}, {""id"": 35, ""name"": ""Comedy""}, {""id"": 10751, ""name"": ""Family""}, {""id"": 12, ""name"": ""Adventure""}]"	http://disney.go.com/disneypictures/up/		en	Up	Carl Fredricksen spent his entire life dreaming of exploring the globe and experiencing life to its fullest. But at age 78, life seems to have passed him by, until a twist of fate (and a persistent 8-year old Wilderness Explorer named Russell) gives him a new lease on life.	92.201962	2009-05-13	735099082	96		Up	7.7	6870
"[{""id"": 16, ""name"": ""Animation""}, {""id"": 10751, ""name"": ""Family""}, {""id"": 12, ""name"": ""Adventure""}, {""id"": 878, ""name"": ""Science Fiction""}]"	http://www.monstersvsaliens.com/		en	Monsters vs Aliens	When Susan Murphy is unwittingly clobbered by a meteor full of outer space gunk on her wedding day, she mysteriously grows to 49-feet-11-inches. The military jumps into action and captures Susan, secreting her away to a covert government compound. She is renamed Ginormica and placed in confinement with a ragtag group of Monsters...	36.167578	2009-03-19	381509870	94	When aliens attack, monsters fight back.	Monsters vs Aliens	6.0	1423
"[{""id"": 28, ""name"": ""Action""}, {""id"": 878, ""name"": ""Science Fiction""}, {""id"": 12, ""name"": ""Adventure""}]"	http://www.ironmanmovie.com/		en	Iron Man	After being held captive in an Afghan cave, billionaire engineer Tony Stark creates a unique weaponized suit of armor to fight evil.	120.725053	2008-04-30	585174222	126	Heroes aren't born. They're built.	Iron Man	7.4	8776
"[{""id"": 12, ""name"": ""Adventure""}, {""id"": 18, ""name"": ""Drama""}, {""id"": 10751, ""name"": ""Family""}]"	http://www.hugomovie.com/		en	Hugo	Hugo is an orphan boy living in the walls of a train station in 1930s Paris. He learned to fix clocks and other gadgets from his father and uncle which he puts to use keeping the train station clocks running. The only thing that he has left that connects him to his dead father is an automaton (mechanical man) that doesn't work without a special key which Hugo needs to find to unlock the secret he believes it contains. On his adventures, he meets with a shopkeeper, George Melies, who works in the train station and his adventure-seeking god-daughter. Hugo finds that they have a surprising connection to his father and the automaton, and he discovers it unlocks some memories the old man has buried inside regarding his past.	32.319043	2011-11-22	185770160	126	One of the most legendary directors of our time takes you on an extraordinary adventure.	Hugo	7.0	2141
"[{""id"": 28, ""name"": ""Action""}, {""id"": 12, ""name"": ""Adventure""}, {""id"": 35, ""name"": ""Comedy""}, {""id"": 878, ""name"": ""Science Fiction""}, {""id"": 37, ""name"": ""Western""}]"			en	Wild Wild West	Legless Southern inventor Dr. Arliss Loveless plans to rekindle the Civil War by assassinating President U.S. Grant. Only two men can stop him: gunfighter James West and master-of-disguise and inventor Artemus Gordon. The two must team up to thwart Loveless' plans.	40.748915	1999-06-29	222104681	106	It's a whole new west.	Wild Wild West	5.1	1020
"[{""id"": 12, ""name"": ""Adventure""}, {""id"": 28, ""name"": ""Action""}, {""id"": 14, ""name"": ""Fantasy""}]"	http://www.themummy.com/		en	The Mummy: Tomb of the Dragon Emperor	Archaeologist Rick O'Connell travels to China, pitting him against an emperor from the 2,000-year-old Han dynasty who's returned from the dead to pursue a quest for world domination. This time, O'Connell enlists the help of his wife and son to quash the so-called 'Dragon Emperor' and his abuse of supernatural power.	60.034162	2008-07-01	401128639	112	A New Evil Awakens.	The Mummy: Tomb of the Dragon Emperor	5.2	1387
"[{""id"": 28, ""name"": ""Action""}, {""id"": 12, ""name"": ""Adventure""}, {""id"": 80, ""name"": ""Crime""}, {""id"": 14, ""name"": ""Fantasy""}, {""id"": 878, ""name"": ""Science Fiction""}]"	http://www.suicidesquad.com/		en	Suicide Squad	From DC Comics comes the Suicide Squad, an antihero team of incarcerated supervillains who act as deniable assets for the United States government, undertaking high-risk black ops missions in exchange for commuted prison sentences.	90.23792	2016-08-02	745000000	123	Worst Heroes Ever	Suicide Squad	5.9	7458
"[{""id"": 14, ""name"": ""Fantasy""}, {""id"": 35, ""name"": ""Comedy""}, {""id"": 10751, ""name"": ""Family""}]"	http://www.evanalmighty.com/		en	Evan Almighty	God contacts Congressman Evan Baxter and tells him to build an ark in preparation for a great flood.	27.082182	2007-06-09	173000000	96	A comedy of biblical proportions	Evan Almighty	5.3	1151
"[{""id"": 28, ""name"": ""Action""}, {""id"": 878, ""name"": ""Science Fiction""}]"	http://www.edgeoftomorrowmovie.com/		en	Edge of Tomorrow	Major Bill Cage is an officer who has never seen a day of combat when he is unceremoniously demoted and dropped into combat. Cage is killed within minutes, managing to take an alpha alien down with him. He awakens back at the beginning of the same day and is forced to fight and die again... and again - as physical contact with the alien has thrown him into a time loop.	79.456485	2014-05-27	370541256	113	Live, Die, Repeat	Edge of Tomorrow	7.6	4858
"[{""id"": 12, ""name"": ""Adventure""}, {""id"": 28, ""name"": ""Action""}]"			en	Waterworld	In a futuristic world where the polar ice caps have melted and made Earth a liquid planet, a beautiful barmaid rescues a mutant seafarer from a floating island prison. They escape, along with her young charge, Enola, and sail off aboard his ship. But the trio soon becomes the target of a menacing pirate who covets the map to 'Dryland' – which is tattooed on Enola's back.	44.640292	1995-07-28	264218220	135	Beyond the horizon lies the secret to a new beginning.	Waterworld	5.9	992
"[{""id"": 12, ""name"": ""Adventure""}, {""id"": 28, ""name"": ""Action""}, {""id"": 53, ""name"": ""Thriller""}, {""id"": 878, ""name"": ""Science Fiction""}]"	http://www.gijoemovie.com/		en	G.I. Joe: The Rise of Cobra	From the Egyptian desert to deep below the polar ice caps, the elite G.I. JOE team uses the latest in next-generation spy and military equipment to fight the corrupt arms dealer Destro and the growing threat of the mysterious Cobra organization to prevent them from plunging the world into chaos.	32.852443	2009-08-04	302469017	118	When all else fails, they don't.	G.I. Joe: The Rise of Cobra	5.6	1962
"[{""id"": 18, ""name"": ""Drama""}, {""id"": 35, ""name"": ""Comedy""}, {""id"": 16, ""name"": ""Animation""}, {""id"": 10751, ""name"": ""Family""}]"	http://movies.disney.com/inside-out		en	Inside Out	Growing up can be a bumpy road, and it's no exception for Riley, who is uprooted from her Midwest life when her father starts a new job in San Francisco. Like all of us, Riley is guided by her emotions - Joy, Fear, Anger, Disgust and Sadness. The emotions live in Headquarters, the control center inside Riley's mind, where they help advise her through everyday life. As Riley and her emotions struggle to adjust to a new life in San Francisco, turmoil ensues in Headquarters. Although Joy, Riley's main and most important emotion, tries to keep things positive, the emotions conflict on how best to navigate a new city, house and school.	128.655964	2015-06-09	857611174	94	Meet the little voices inside your head.	Inside Out	8.0	6560
"[{""id"": 10751, ""name"": ""Family""}, {""id"": 12, ""name"": ""Adventure""}, {""id"": 18, ""name"": ""Drama""}, {""id"": 14, ""name"": ""Fantasy""}]"	http://movies.disney.com/the-jungle-book-2016		en	The Jungle Book	After a threat from the tiger Shere Khan forces him to flee the jungle, a man-cub named Mowgli embarks on a journey of self discovery with the help of panther, Bagheera, and free spirited bear, Baloo.	94.199316	2016-04-07	966550600	106		The Jungle Book	6.7	2892
"[{""id"": 12, ""name"": ""Adventure""}, {""id"": 28, ""name"": ""Action""}, {""id"": 878, ""name"": ""Science Fiction""}]"	http://www.ironmanmovie.com/		en	Iron Man 2	With the world now aware of his dual life as the armored superhero Iron Man, billionaire inventor Tony Stark faces pressure from the government, the press and the public to share his technology with the military. Unwilling to let go of his invention, Stark, with Pepper Potts and James 'Rhodey' Rhodes at his side, must forge new alliances – and confront powerful enemies.	77.300194	2010-04-28	623933331	124	It's not the armor that makes the hero, but the man inside.	Iron Man 2	6.6	6849
"[{""id"": 12, ""name"": ""Adventure""}, {""id"": 14, ""name"": ""Fantasy""}, {""id"": 18, ""name"": ""Drama""}]"	http://www.snowwhiteandthehuntsman.com/		en	Snow White and the Huntsman	After the Evil Queen marries the King, she performs a violent coup in which the King is murdered and his daughter, Snow White, is taken captive. Almost a decade later, a grown Snow White is still in the clutches of the Queen. In order to obtain immortality, The Evil Queen needs the heart of Snow White. After Snow escapes the castle, the Queen sends the Huntsman to find her in the Dark Forest.	77.178973	2012-05-30	396600000	127	The Fairytale is Over	Snow White and the Huntsman	5.8	3118
